Nama Franchise,Modal Minimal,Kategori Franchise,Franchise Fee,Nama Perusahaan,Biaya Royalti,Berdiri Sejak,Biaya Advertising,Jumlah Gerai,Alamat,Contact Person,Nomor WA,Telepon,Fax,Email,Website
Cheese Tea Co,Rp 7.000.000,Makanan & Minuman,-,Cheese Tea Co ,-,2019.0,-,5.0,Jl Raya Tajem No 15 55593 Yogyakarta ,Cheese Tea Co ,+628112821904  (Klik nomor untuk chat via WA),(0274) 4363086 08112821904 , ,-,Klik : https://cheeseteaco.com/
Cheese Tea Inc,Rp 18.900.000,Makanan & Minuman,FREE,CV. Startup International  ,FREE,2018.0,FREE,32.0,"Jl. Trembesi Blok D 4, Bandarbaru, Kemayoran  ",Cheese Tea Inc Jp Customer Relation ,+6285735300400  (Klik nomor untuk chat via WA),Hp :085 735 300 400(Christyne) Hp :081 390 715 489 (Rista)  , ,cheeseteainc@gmail.com,Klik : http://Www.cheeseteainc.com
Chicken Bite,Rp 4.200.000,Makanan & Minuman,-,Chicken Bite ,-,,-,,"Jln Amarta No 15, 55593 Yogyakarta ",Chicken Bite ,+628112934629  (Klik nomor untuk chat via WA),0811 293 4629 0811 282 7180 Tlp :(0274)2834650 , ,chickenbite@mail.com,Klik : https://friedchickenbites.com/
chicken crips,Rp 55.000.000,Makanan & Minuman,55000000, ,,2013.0,,3.0,jalan pangandaran barat no 1 ancol sunter  ,david  ,+6281806237099  (Klik nomor untuk chat via WA),081806237099 , ,chickencrips@yahoo.com,-
Chicken Crush Indonesia,Rp (Please Call),Makanan & Minuman,,CV Chicken Crush Indonesia ,,2017.0,,35.0,"Jl. Jambon No. 42, Trihanggo, Sleman ",Bpk Roy ,+6282232463377  (Klik nomor untuk chat via WA),Hp : 0822 3246 3377 Tlp: (0274) 501 5339 , ,outlet.chickencrush@gmail.com,Klik : http://chickencrush.id
CHICKEN DAY,Rp 200.000.000,Makanan & Minuman,30 % dari harga franchise,CHICKEN DAY INDONESIA ,5 % dari omset kotor/ bulan,2012.0,-,40.0,"NERADA ESTATE A10 / 15 CIPAYUNG CIPUTAT, TANGERANG SELATAN ",WIWI WIHARTI ,+6281510773275  (Klik nomor untuk chat via WA),0815 1077 3275  0812 8392 3964  021 74717858 , ,CHICKENDAYID@YAHOO.CO.ID,Klik : http://WWW.CHICKENDAY.CO.ID
Chicken Gunting,Rp 2.000.000,Makanan & Minuman,,Chicken Gunting Indonesia ,,2016.0,,19.0,Jl. Kebangkitan nasional no 63 Jebres Solo ,Chicken Gunting ,+6282354038515  (Klik nomor untuk chat via WA),0823 5403 8515 , ,bintangmarsiwa@gmail.com,-
Chicken Jazzz,Rp 4.500.000,Makanan & Minuman,0,Jazzz ,0,2019.0,0,12.0,Pekalongan ,Chicken Jazzz ,+6281517777111  (Klik nomor untuk chat via WA),0858 4879 1000 , ,chickenjazzz5@gmail.com,-
Chicken Lemon,Rp 2.000.000,Makanan & Minuman,,CV. Galerindo Nusantara ,,2016.0,,36.0,Jln. Ir sutami no 93 solo ,Chicken Lemon ,+6282118612735  (Klik nomor untuk chat via WA),0821 1861 2735 , ,Info@galeripedas.net,Klik : http://www.chickenlemon.com
Chicken Popop,Rp 7.500.000,Makanan & Minuman,-,Chicken Popop ,-,2013.0,-,250.0,"Jl. Kenanga No. 14 Badran, Purwosari, laweyan, Solo 57142 ",Meta (marketing) ,+6282136371117  (Klik nomor untuk chat via WA),082136371117 , ,Chickenpopop.id@gmail.com,-
Chicken Rock,Rp 5.000.000,Makanan & Minuman,-, ,-,2020.0,-,1.0,"Jl. Bintara 14 No.17-18, RT.002/RW.014, Bintara, Kec. Bekasi Bar., Kota Bks, Jawa Barat 17134 ",Chicken Rock ,+628112654724  (Klik nomor untuk chat via WA),Hp : 0811 2654 724 , ,chickenrock@gmail.com,Klik : http://www.chickenrock.net
Chicken Skak by Bayu Skak,Rp 6.500.000,Makanan & Minuman,-,Skak Food  ,-,2018.0,-,120.0,"Jalan Raya Tajem, Ruko Alam Persada 2 No.2 Tajem Maguwoharjo Sleman Yogyakarta ",Chicken Skak ,+628112827165  (Klik nomor untuk chat via WA),0811 282 7165 (Tutut) 0811 282 8483 Tlp: (0274) 283 4650 , ,cs.skakfood@gmail.com,Klik : https://skakfood.com
Chicklada,Rp 35.000.000,Makanan & Minuman,,PT Sumpitmas Berkah Amanah ,,2018.0,,8.0,"Jl. Indramayu Raya No.41 Antapani, Bandung. ",Chicklada ,+628172300002  (Klik nomor untuk chat via WA),022 20546940 , ,hello@pinchicken.id,-
Chick n Pop,Rp 8.800.000,Makanan & Minuman,-, ,-,2019.0,-,9.0,Jalan Basuki Rahmat no 1 Palembang ,Chick n Pop ,+6287897443548  (Klik nomor untuk chat via WA),0878 9744 3548 , ,chicknpop99@yahoo.com,-
Choco Station,Rp 3.500.000,Makanan & Minuman,-,Choco Station ,-,2019.0,-,4.0,Jl. Sidotopo Wetan no 237 Surabaya (Samping Statiun Sidotopo Surabaya) ,Choco Station ,+6285236773489  (Klik nomor untuk chat via WA),Marketing Franchise : 0852-3677-3489  Telp Kantor : 0815 5998 5918 , ,chocostationdrink@gmail.com,-
Choco Village,Rp 75.000.000,Makanan & Minuman,,Idea Corp ,,2019.0,,7.0,"Jl. Kebon Raya No. 9, Duri Kepa, Kebon Jeruk, Jakarta Barat ",Choco Village ,+6281919788877  (Klik nomor untuk chat via WA),Hp : 0819 1978 8877 Telp : (021) 5696 6030 , ,sekretarisidea@gmail.com,-
Chomelt,Rp 3.800.000,Makanan & Minuman,-, ,-,2020.0,-,5.0,"Jl. hasanunin no 57, Surakarta ",Chomelt ,+6287812609689  (Klik nomor untuk chat via WA),0878 1260 9689 , ,mommilkgroup@gmail.com,Klik : http://chomeltsignature.com
Chop Buntut Cak Yo,Rp (Please Call),Makanan & Minuman,-,The Aroma Group ,-,2015.0,-,31.0,"Jln. Kejaksaan No. 137 A, Medan, Sumatera Utara ",Chop Buntut Cak Yo ,+6281261601466  (Klik nomor untuk chat via WA),Hp : 0812 6160 1466 0821 6666 2988 , ,-,Klik : http://www.chopbuntut.com
Churrobites,Rp 40.000.000,Makanan & Minuman,,Churrobites ,,2018.0,,14.0,Jakarta ,Churrobites ,+6281289746762  (Klik nomor untuk chat via WA),081289746762 , ,churrobitesindo@gmail.com,-
Cilok DJoedes,Rp 5.000.000,Makanan & Minuman,-,Cilok DJoedes ,-,2017.0,-,6.0,"Pasar Modern BSD Jl Letnan Sutopo Blok R10 Tangerang Selatan, Banten ",Cilok DJoedes ,+6288213017700  (Klik nomor untuk chat via WA),0882 1301 7700 (Mika) 0812 1288 3043 , ,cilokdjoedes@gmail.com,Klik : http://www.cilokdjoedes.com/
Cilok Nonik,Rp 5.000.000,Makanan & Minuman,0,Cilok NONIK ,0,2018.0,0,41.0,Mangunsuparnan RT 10/ Rw O5 Janti polanharjo klaten ,081392399300 ,+6281392399300  (Klik nomor untuk chat via WA),081392399300 , ,bajingkanan@gmail.com,-
Cilok Pop,Rp 4.000.000,Makanan & Minuman,-,Cilok Pop ,-,,-,,"Yogyakarta Jl. Raya Tajem No 15, 55593 ",Cilok Pop ,+628112934629  (Klik nomor untuk chat via WA),(0274) 2834650 Hp : 0811293347 , ,-,Klik : https://cilokpop.com/
CIZI Cheese Tea,Rp 16.800.000,Makanan & Minuman,FREE,CV. Startup International ,FREE,2018.0,FREE,11.0,"Fontana Office Tower Jl. Trembesi Blok D 4, Bandarbaru, Kemayoran ",CIZI Cheese Tea ,+6285735300400  (Klik nomor untuk chat via WA),085 735 300 400 , ,cizitea@gmail.com,Klik : http://www.cizitea.com
CLBK KOPI,Rp 78.000.000,Makanan & Minuman,-,PT. Cara Loe Buat Kopi ,-,2019.0,-,60.0,"Jl. BSD Raya Utama Ruko Alicante, Blk. C No.25, Medang, Kec. Pagedangan, Tangerang Banten 15334 ",CLBK KOPI ,+6281927200200  (Klik nomor untuk chat via WA),0819 2720 0200 0877 8466 8407 , ,franchise.clbk@gmail.com,Klik : http://www.clbk.coffee
Cleanlite Laundry,Rp 65.000.000,Laundry & Jasa Kebersihan,65000000,Cleanlite Laundry ,0,2017.0,0,16.0,"Rukan Greatwall B28, Green Lake City , Cipondoh Tangerang ",Sugiarto ,+628118497979  (Klik nomor untuk chat via WA),0811 849 7979  0817 0319 3911 , ,sugiarto@ahlijasa.com / cleanlite@ahlijasa.com,Klik : http://www.cleanlitelaundry.com
Clement's Ice Cream,Rp 5.000.000,Makanan & Minuman,Rp 3.500.000,Clement's Ice Cream ,0,2009.0,0,54.0,"Jl. Trimezia VI no. 23, Curug Sangereng, Kelapa Dua, Kab. Tangerang, 15810 ",Kevin ,+6281113801771  (Klik nomor untuk chat via WA),081113801771 , ,clementsicecream@gmail.com,Klik : https://www.instagram.com/clementsicecream/
Clothes Laundry,Rp 15.000.000,Laundry & Jasa Kebersihan,-,CV. RPTF ,-,2011.0,-,25.0,Jalan Astana Anyar no.12 ,Irfan ,+6281910002040  (Klik nomor untuk chat via WA),0819-1000-2040 Marketing Sales ,- ,Clotheslaundry@gmail.com,Klik : https://instagram.com/clotheslaundry
Cobek Pawonku,Rp 30.000.000,Makanan & Minuman,-,Cobek Pawonku ,-,2016.0,-,5.0,Jalan H. Emutipala 1 no.18 RT.03/07 Kp. Makasar Jakarta timur ,Cobek Pawonku ,+6287784321189  (Klik nomor untuk chat via WA),0812 9317 6859  0877 8432 1189 , ,cobekpawonku@gmail.com,-
Coboy Chicken,Rp 10.000.000,Makanan & Minuman,,PT Cakrasemesta Abadi Sejahtera ,,2018.0,,8.0,"JL. Walang Baru 6, Blok A No.6, RT.7/RW.7, Tugu Utara, Koja, Kota Jkt Utara, Daerah Khusus Ibukota Jakarta  ",Coboy Chicken ,+6281316063799  (Klik nomor untuk chat via WA),Mr. Tan Eliezar : 0812 1919 8123 Ms. Dwi : 0813 1606 3799 Ms. Emi : 0813 1106 8954 , ,coboychicken@gmail.com,Klik : http://coboychicken.com
Co.Choc,Rp 135.000.000,Makanan & Minuman,-,Co.Choc ,-,2018.0,-,100.0,"Jl. L. L. R.E. Martadinata No.205, Cihapit, Kec. Bandung Wetan, Kota Bandung, Jawa Barat 40114 ",Comfort Of Chocolate ,+6287840027985  (Klik nomor untuk chat via WA),"Hp : 0813 2015 6311 Hp : 0878 4002 7985  Head Office Gran Rubina Building, 15th Floor Epicentrum, Kuningan - South Jakarta  Telp. +62 21 8086 8448 Email. pt.mbv@mbv-group.com ", ,info.cochoc@gmail.com,-
Coconut Power,Rp 10.000.000,Makanan & Minuman,-,Coconut Power ,-,2019.0,-,5.0,Jl Kyai Telingsing Gg Daulat no.168B Kudusan Jawa Tengah Indonesia 59317 ,Coconut Power ,+6282191253838  (Klik nomor untuk chat via WA),0821 9125 3838 , ,-,-
Coffee & Chef,Rp 385.000.000,Makanan & Minuman,-,Coffee & Chef ,5 % dari omzet,2012.0,-,35.0,"JL. RAJAKWESI 17B, Malang ","YUDI HARYANTO, SH ",+6285234998808  (Klik nomor untuk chat via WA),Hp:085234998808 Kantor : 0341-580621 ,- ,coffeeandchef@yahoo.com,Klik : http://www.coffeeandchef.com
Coffeeland Indonesia,Rp 78.000.000,Makanan & Minuman,-,Coffeeland Indonesia ,-,2010.0,-,75.0,"Jl. Naripan No. 53, Kebon Pisang, Sumur Bandung, Kota Bandung, Jawa Barat 40262 ",Coffeeland ,+6281322356979  (Klik nomor untuk chat via WA),Hp : 0813 2235 6979 Hp : 087 82595 8155 , ,marketing.coffeeland.id@gmail.com,Klik : http://www.coffeeland.co.id
Coffee Toffee,Rp 800.000.000,Makanan & Minuman,,PT.Coffee Toffee Indonesia ,,2006.0,,100.0,"Surabaya Office : Jl. Dharmahusada 181 Surabaya, Jawa Timur  Bogor Office : Jl. Achmad Adnawijaya Panduraya 84, Panduraya, Bogor, Jawa Barat ",Coffee Toffee ,+6282145992006  (Klik nomor untuk chat via WA),0821 4599 2006 (Hotline) (031) 592 9500 (Surabaya) 0813 1933 9952 (Bogor) , ,info@coffeetoffee.co.id,Klik : http://www.coffeetoffee.co.id
COKLAT FANTASY,Rp 3.000.000,Makanan & Minuman,,RATU ROSARI ,,2013.0,,280.0,JL HASANUDIN 88 PUNGGAWAN SURAKARTA ,Yoga hermawan ,+6281325007805  (Klik nomor untuk chat via WA),Hp :0813 2500 7805(Marketing) Tlp:02717892151 , ,coklatfantasy88@gmail.com,Klik : http://www.coklatfantasy.com
Coklat Serius,Rp 2.700.000,Makanan & Minuman,-,Coklat Serius ,-,2014.0,-,375.0,"Kramat, Laweyan, Surakarta 57148 ",Erwin Sudarmadi ,+628122253538  (Klik nomor untuk chat via WA),Kantor :(0271) 7641900 Hp : +62 812-2253-538 ( erwin ) , ,coklatserius@gmail.com,Klik : http://www.coklatserius.com
Cokoji Coffee,Rp 7.000.000,Makanan & Minuman,, ,,2017.0,,9.0,Jl. Melati No. 01 Kejambon Tegal Jawa Tengah ,0823 1300 1818 ,+6282313001818  (Klik nomor untuk chat via WA),0823 1300 1818 , ,Cokojicoffee1@gmail.com,-
Conejo Taco,Rp 5.800.000,Makanan & Minuman,-,Conejo Taco American Fusion ,-,2021.0,-,5.0,Jl Gajah Mada No 42 Timuran Banjaran Solo ,Conejo Taco ,+6285272305662  (Klik nomor untuk chat via WA),Hp : 0852 7230 5662 , ,conejotaco.marketing@gmail.com,Klik : http://wa.me/6285272305662
COOLIO BARBERSHOP,Rp 60.000.000,Lainnya,60 JUTA,CV.COOLIO INDONESIA ,10% sd 7% dari OMSET,2015.0,FREE,26.0,JL. GUBENG KERTAJAYA VII H / 6 SURABAYA ,TRIYAN ,+6285664210513  (Klik nomor untuk chat via WA),Hp : 087852800201 - 085664210513  ,- ,cooliohairmake@gmail.com,Klik : http://www.cooliobarbershop.co.id
Corner Kebab,Rp 40.000.000,Makanan & Minuman,,Corner Kebab Indonesia  ,,2007.0,,400.0,"Kantor Pusat : Ruko Ogie Plaza Blok A2-3, Jalan Siliwangi no.8 Pamulang Tangerang Selatan  Kantor Cabang Bandung : Ruko Pesona Cisaranten Indah No.1 Jalan Cisarranten Kulon, Arcamanik Bandung ",Corner Kebab ,+628123119071  (Klik nomor untuk chat via WA),0812 3119 071 0813 8888 6163 Telp : 021-7493969 , ,unix.ugpm@gmail.com,Klik : http://www.cornerkebabonline.com
COSCO (CHOISE OF CHOCOLATE),Rp 3.000.000,Makanan & Minuman,-,CV RATU ROSARI ,-,2015.0,-,70.0,"JL HASANUDIN 88, PASAR NANGKA, PUNGGAWAN, SOLO JAWA TENGAH ",0271 7892151 ,+6281370571857  (Klik nomor untuk chat via WA),0271 7892151 , ,cvraturosari@yahoo.com,-
Crepes Es Krimku,Rp 15.000.000,Makanan & Minuman,0,Fina Home Industri  ,0,2014.0,0,2.0,"Perumahan gading Mas no. 4, Junrejo, Kota Batu, Jawa Timur ",Fina Home Industry ,+6285706575973  (Klik nomor untuk chat via WA),0852 5797 1468 (Fina)  0857 0657 5973 (Ana) , ,fik_ram_si@yahoo.com,Klik : http://finahomeindustry.com
Criptos Crispy Potatoes,Rp 4.100.000,Makanan & Minuman,-,Criptos Crispy Potatoes ,-,,-,10.0,"Yogyakarta Jl. Raya Tajem No 15, 55593 ",Criptos Crispy Potatoes ,+628112821904  (Klik nomor untuk chat via WA),Hp : 0811 292 7935 Tlp: (0274)2834650 , ,criptos@mail.com,Klik : https://crispypotatoes.com/
Cuan Boba Indonesia,Rp 14.500.000,Makanan & Minuman,-,CV Ombe Indonesia ,-,2019.0,-,5.0,"Jln Dahlia F3, Perum Puri Gading, Grogol, Sukoharjo  ",Cuan Boba Indonesia ,+6285647000672  (Klik nomor untuk chat via WA),Hp : 085647000672 , ,cuanboba@gmail.com,Klik : http://www.cuanboba.com
Cup Q Go Ice Blend,Rp 5.000.000,Makanan & Minuman,0,PT. Intrafood Singabera Indonesia ,0,2020.0,0,10.0,"Jl. Arak-arak No.52, Dusun II, Telukan, Kec. Grogol, Kabupaten Sukoharjo, Jawa Tengah 57552 ",(0271) 641277 ,+6285877213296  (Klik nomor untuk chat via WA),(0271) 641 277 , ,capq2020@gmail.com,-
Curves Indonesia,Rp (Please Call),Kesehatan & Kecantikan,-,PT. Unity Brands Indonesia ,-,2018.0,-,8.0,Jl. Surya Sumantri No. 76 Lt.2 Bandung 40164 Jawa Barat Indonesia ,Yenni  ,+628112002787  (Klik nomor untuk chat via WA),Hp : +6281 1200 2787 : +6222 2027 1110 , ,investor@curvesindonesia.com,Klik : http://www.curvesindonesia.com
Cut Chicken,Rp 7.500.000,Makanan & Minuman,-,Cut Chicken ,-,2020.0,-,1.0,Jln ,Cut Chicken ,+6282150147766  (Klik nomor untuk chat via WA),+6282 1501 47766 , ,cutchicken99@yahoo.com,-
Daddys Takoyaki,Rp 18.000.000,Makanan & Minuman,-,Daddys Takoyaki ,-,2012.0,-,25.0,Jl. Jati Padang Rt 006/08 no.18 pasar minggu Jakarta selatan 12540 ,Muhamad Fadli azis ,+6281212764874  (Klik nomor untuk chat via WA),081212764874 (Whats App)   0812-1276-4874 (Telkomsel)  ,- ,daddystakoyaki@gmail.com,Klik : http://www.daddystakoyaki.com
Daging Warga,Rp 25.000.000,Makanan & Minuman,, ,,2020.0,,2.0,"Perumahan Taman Narogong Indah, Jalan Raya Taman Narogong Indah No.10, RT.007/RW.013, Bojong Rawalumbu, Bekasi Timur, Jawa Barat 17116, Indonesia ",Daging Warga ,+6282113140304  (Klik nomor untuk chat via WA),0821 1314 0304  IG : @daging.warga , ,dagingwarga@gmail.com,Klik : http://dagingwarga.com
Daily Fresh Water,Rp 340.000.000,Lainnya,,PT. Airku Sehat Segar Alami ,,2003.0,,56.0,Jl. Joglo Raya No. 5 (dekat kantor kelurahan Joglo) Joglo Kembangan - Jakarta Barat Indonesia ,Daily Fresh Water ,+628119920160  (Klik nomor untuk chat via WA),021 - 2254 - 1812  0811 9920 160  Franchise Marketing Maya :  0811 - 8380 - 307 0815 - 1312 - 2531 , ,mwb.claramaya@gmail.com,Klik : http://www.dailyfreshwater.com
Daily Loaf Bread,Rp 5.000.000,Makanan & Minuman,,Daily Loaf Bread ,,2018.0,,5.0,Jakarta ,Daily Loaf Bread ,+6281380010083  (Klik nomor untuk chat via WA),0813 800 100 83 , ,-,Klik : http://dailyloaf.id/
Dapoer Roti Bakar,Rp 200.000.000,Makanan & Minuman,-,Dapoer Roti Bakar ,-,2013.0,-,12.0,"Jalan Raya Pasar Minggu No.15C, Jakarta Selatan ",Dapoer Roti Bakar ,+6281905112239  (Klik nomor untuk chat via WA),Hp : 081905112239(Aditia)  Hp : 081574017495(Dhenny)  Hp : 081908688843(Irma) , ,dapoerrotibakar@gmail.com / warungpaparoti@gmail.com,Klik : http://rotibakar.id
Dapur Serundeng,Rp 58.000.000,Makanan & Minuman,, ,,2014.0,,7.0,"Jl. Duri Kosambi No. 17 Cengkareng, Jakarta Barat ",Dapur Serundeng ,+6285695232039  (Klik nomor untuk chat via WA),0856 9523 2039  0899 8218 106 (Anggun)  0811 83 53 83 (Andrew)  Office : 021-5458 927 , ,anggun.dapurserundeng@gmail.com,-
Dawetan,Rp 3.900.000,Makanan & Minuman,-,Dawetan Indonesia ,-,2020.0,-,1.0,"Jalan Merak RT 04 RW 22, Waringin Rejo, Cemani, Grogol, Sukoharjo, Jawa Tengah ",Dawetan ,+6282298344288  (Klik nomor untuk chat via WA),Hp : 082298344288  , ,dawetanofficial@gmail.com,Klik : http://dawetan.com
Dawet Aye,Rp 3.800.000,Makanan & Minuman,-,Dawet Aye Indonesia ,-,2020.0,-,1.0,"Jalan Merak RT 04 RW 22, Waringin Rejo, Cemani, Grogol, Sukoharjo, Jawa Tengah ",Dawet Aye  ,+6282298344277  (Klik nomor untuk chat via WA),Hp : 0822 9834 4277 , ,dawetayeofficial@gmail.com,Klik : http://dawetaye.com
Dawet Kemayu,Rp 7.900.000,Makanan & Minuman,-,PT. Najah Kuliner Nusantara ,-,2020.0,-,97.0,"Jl.Pandeyan, Gg. Empu Triguna, No. 807, Kel.Pandeyan, Kec. Umbulharjo. Yogyakarta ",Firdha Puteri Dinda ,+6282137576896  (Klik nomor untuk chat via WA),+62 821-3757-6896 (Firdha Puteri Dinda) , ,dawetkemayu.id@gmail.com,Klik : http://dawetkemayu.com
DAYCINNO,Rp 4.000.000,Makanan & Minuman,-,DAYCINNO COFFEE&CO ,-,2012.0,-,530.0,"NERADA ESTATE A10/ 15 CIPAYUNG, CIPUTAT, TANGERANG SELATAN, BANTEN INDONESIA ",Syukri Ahkam ,+6281510773275  (Klik nomor untuk chat via WA),081283923964  (021)74717858 ,- ,daycinno@yahoo.co.id,Klik : http://www.daycinno.com
D'Celup Tanglor,Rp 8.000.000,Makanan & Minuman,-,Master Kuliner Indonesia ,-,2019.0,-,28.0,"Jl. Lereng Indah No.81 RT 01 RW 12 Limo, Cinere, Sawangan, Depok, Jawa Barat ",D'Celup Tanglor ,+6285775753939  (Klik nomor untuk chat via WA),Marketing : 0822 4646 8383 0878 9898 8080  Master Kuliner Indonesia : 0878 4646 7373    , ,masterkuliner@gmail.com,Klik : https://dceluptanglor.com/
D'Cuan Drinks,Rp 12.000.000,Makanan & Minuman,Rp 11.950.000,D'Cuan Drinks ,-,2020.0,-,1.0,"Jalan Pulo Wonokromo No. 297i, Surabaya  ",D'Cuan Drinks ,+6281232460492  (Klik nomor untuk chat via WA),Hp : 0812 3246 0492 , ,dcuan.drink@gmail.com,-
Dear Sweet,Rp 55.000.000,Makanan & Minuman,-,Dear Sweet ,-,2016.0,-,10.0,"Surabaya, Jawa Timur ",Dear Sweet ,+6281804504600  (Klik nomor untuk chat via WA),0818 0450 4600 , ,-,-
Demi Kopi,Rp 65.800.000,Makanan & Minuman,-,PT. Rasa Prima Mitra Sentosa ,-,2020.0,-,8.0,"Apartment Sentra Timur Residence K11 TB, Cakung, Pulogebang, Jakarta Timur 13950 ",Demi Kopi ,+6287771575594  (Klik nomor untuk chat via WA),+62819 1888 8805  +62857 7361 0839 , ,rasaprimamitrasentosa.group@gmail.com,Klik : http://www.demikopicorp.com
DIGIKIDZ,Rp 300.000.000,Jasa Pendidikan & Pelatihan,Rp. 185.000.000/ Unit,PT. DIGIKIDZ INDONESIA ,12%/ Bulan,2001.0,-,11.0,"Ruko BSD Sektor IV Blok RD/69, BSD City, Tangerang Selatan. ",Rendy ,+6281808252213  (Klik nomor untuk chat via WA),021-5371 163 +62 818-0825-2213 , ,rendi@digikidz.id / steven.deverano@digikidz.id / henny.agustine@digikidz.id,Klik : http://www.digikidz.id
Dimsum Mbledos,Rp 9.000.000,Makanan & Minuman,-, ,-,2011.0,-,300.0,Jl. Kalijudan Mulia no 25 Surabaya ,Dimsum Mbledos ,+6282244820888  (Klik nomor untuk chat via WA),Hp : 082244820888(Saul) Hp : 082245833399(Ghea) Hp : 085337855557(Anisa) Tlp: (031)99923252 , ,info@dimsummbledos.com,Klik : http://www.dimsummbledos.com
Dimsum Resanba,Rp 6.500.000,Makanan & Minuman,-,CV. Muda Cipta Boga ,-,2018.0,-,10.0,"JL. PLERED, KEBON KOPI NO.59 RT.02 / RW.008 PENGASINAN, SAWANGAN, DEPOK - JAWA BARAT (16518) ",Dimsum Resanba ,+6282112226828  (Klik nomor untuk chat via WA),Hp : 0821 1222 6828 , ,dimsumresanba@gmail.com,Klik : http://dimsum-resanba.com/
Dimsum Salmon,Rp 8.750.000,Makanan & Minuman,,Dimsum Salmon ,,2019.0,,24.0,"Perum bali View, Kp. Ubud, Jl. Kintamani Raya Blok B7 No. 12 , Cirendeu Ciputat Timur Kota Tangerang Selatan. ",08118812120 ,+628118812120  (Klik nomor untuk chat via WA),08118812120  Informasi Kemitraan Call Center Pusat : 0811 8812 120 Call Center Bandung : 0812 2486 2209 , ,sgfoodinfo@gmail.com,-
Dino Express,Rp (Please Call),Business Services,,PT. Dino Logistic Perkasa ,,2010.0,,30.0,Jl. Agung Timur 4 Blok O1 No. 42 - 43 Sunter Jaya Jakarta Utara 14350 ,Dino Express ,+6281808861888  (Klik nomor untuk chat via WA),0818 0886 1888 021 651 7357 , ,cs@dinoexpress.id,Klik : http://www.dinoexpress.id
D'Kriuk Fried Chicken,Rp 21.500.000,Makanan & Minuman,,PT RAJA RASA KULINER ,,2016.0,,633.0,"Jl. Berkerilil RT 02/11 (Belakang PKU Muhammadiayh), Bubulak, Kec. Bogor Barat, Bogor, Jawa Barat 16115 ",D'Kriuk Fried Chicken ,+6282117833330  (Klik nomor untuk chat via WA),Marketing : 0821 1783 3330 , ,dkriukchicken@gmail.com,Klik : http://dkriuk.com
DOKAR (Donat Bakar),Rp 7.500.000,Makanan & Minuman,0,Kreasi Boga Mandiri ,0,2008.0,0,36.0,"Jl. Fajar Indah Utama Ruko no.7-6 perum Fajar Indah,Jajar, Laweyan, surakarta. ",Iwan Abu Shalih ,+628155509109  (Klik nomor untuk chat via WA),0815 550 9109  0813 3782 9120 , ,javadonat@gmail.com,Klik : http://donatbakar.com/
Dokter Mobil,Rp 1.500.000.000,Otomotif,Negotiable,PT Dokter Mobil Management Group ,Negotiable,2013.0,Negotiable,4.0,"Jalan Boulevard Raya Blok QJ1 No.17 Kelapa Gading, Jakarta Utara ",Roy Ivan Fidelis ,+6282211847983  (Klik nomor untuk chat via WA),0822 1184 7983  0878-8789-1999 , ,royivan.fidelis@gmail.com,Klik : http://doktermobil.com
D'ON Fried Chicken,Rp 7.800.000,Makanan & Minuman,,PT. Zanika Multirasa Sejahtera ,,2020.0,,13.0,Jl. Lontar Raya no.3 Tanjung Duren Utara - Jakarta Barat ,D'ON Fried Chicken ,+6281282008105  (Klik nomor untuk chat via WA),No. Telp Kantor : 021-5093 3132  No. Whatsapp : 0812 8200 8105  Telp Marketing Franchise : 0812 8200 8105 , ,d.on.friedchicken.info@gmail.com,Klik : http://d-onfriedchicken.com
Dons Burger & Coffee,Rp 200.000.000,Makanan & Minuman,Rp 135.000.000,PT Dons Bogatama ,4%,2007.0,,7.0,"Jl. Cipinang Muara No. 19, RT 02/RW 015 Jakarta TImur ",Syam Rudjaya ,+6281312121101  (Klik nomor untuk chat via WA),02129360808 , ,infokemitraan123@gmail.com,-
Donuthing by Baim Wong,Rp 29.000.000,Makanan & Minuman,,Idea Corp ,,2019.0,,11.0,"Jln. Kebon Raya No. 9 Duri Kepa, Kebon Jeruk, Jakarta Barat ",Donuthing ,+628119597770  (Klik nomor untuk chat via WA),Hp : 0813 1523 0719 0811 9597 770 0819 1978 8877  Tlp : (021) 5696 6030 , ,sekretarisidea@gmail.com,-
Doyan Ayam,Rp 12.600.000,Makanan & Minuman,-,CV. Semangat Wirausaha ,-,2016.0,-,100.0,Jl. Tandes Kidul 1 No.16 Surabaya-Jawa Timur ,Doyan Ayam ,+6283831065888  (Klik nomor untuk chat via WA),Hp : 0838 3106 5888 , ,doyanayamku@gmail.com,Klik : http://doyanayam.com
dressed Laundry,Rp (Please Call),Laundry & Jasa Kebersihan,-,PT Pro Teknologi ,5%,2009.0,none,5.0,"Jl. Senayan Utama Bintaro Blok HJ3 No.2, Sektor IX, Bintaro Jaya, Tangerang - Jakarta ",Dedi Setiadi ,+6281283066111  (Klik nomor untuk chat via WA),081283066111   , ,dedifam@yahoo.com,Klik : http://www.dressedlaundry.com
Drink Me!,Rp 5.000.000,Makanan & Minuman,3800000,Drink Me! ,-,2020.0,-,31.0,"Jalan. Brigjen Zein Hamid Gang Manggis Indah nomor 57 , Medan, Sumatera Utara ",Drink Me! ,+6282163540609  (Klik nomor untuk chat via WA),Hp : 0821 6354 0609 , ,drinkme.idn@gmail.com,Klik : http://Instagram @drinkme.idn
Dr. Shoes,Rp 35.000.000,Laundry & Jasa Kebersihan,Rp. 35.000.000 & Rp. 70.000.000,Dr. Shoes ,-,2016.0,-,3.0,"Jl. Selokan Mataram No. 94, Seturan, Depok, Sleman ",Dr. Shoes ,+6282133381778  (Klik nomor untuk chat via WA),Hp : 082133381778 , ,dr.shoes@mail.com,-
DUM Thai tea,Rp 9.000.000,Makanan & Minuman,,Nyoklat Management ,,2017.0,,5.0,"Jalan cocak 1 no. 4 Sambeng, Mangkubumen, Banjarsari, Surakarta 57139 ",Marketing ,+6281393229687  (Klik nomor untuk chat via WA),Kantor: 0813 9322 9687  invite BBM : DBBA49DA  Line : dumthaitea , ,dumthaitea@gmail.com,Klik : http://dumthaitea.com
Durian Melintir,Rp 0 (Free),Makanan & Minuman,-,Durian Melintir ,-,,-,76.0,"Pancoran, DKI Jakarta 12760, Indonesia ",Durian Melintir ,+6281394232232  (Klik nomor untuk chat via WA),Hp :081394232232 , ,durianmelintir@gmail.com,-
Dutch Kitchen,Rp 49.000.000,Makanan & Minuman,,Dutch Kitchen ,,2015.0,,3.0,Jalan tiang bendera 5 no 2A. Tambora Jakarta barat. ,Lucky ,+6287886642888  (Klik nomor untuk chat via WA),082366281088 , ,Laberindo.asia@gmail.com,-
DV beauty center,Rp 50.000.000,Kesehatan & Kecantikan,Rp 50.000.000,DV Beauty Center ,10%,2015.0,,3.0,Mall lokasari square Lt dasar FNB 09A Jakarta barat ,DV Beauty Center ,+6282299997168  (Klik nomor untuk chat via WA),Kantor : (021) 626 3996 Hp : 0812 2323 1818 , ,dvbeautycenter@gmail.com,Klik : http://www.dvbeautycenter.com
Eastons Indonesia,Rp (Please Call),"Furniture, Konstruksi, Properti",,Eastons Indonesia ,,,,16.0,Ruko Centro Metro Broadway Blok A 28 Pantai Indah Kapuk Jakarta 14460 ,Eastons Indonesia ,+6287776070217  (Klik nomor untuk chat via WA),Hp : 08777 6070 217 Tlp: (021) 300 10 499 , ,admin@eastons.co.id,Klik : http://eastons.co.id/
Easy English Center (EEC),Rp 5.000.000,Jasa Pendidikan & Pelatihan,,Easy English Center ,,2000.0,,15.0,Jln. Utan Panjang 2 No. 103 Kemayoran Jakarta Pusat ,EEC Hotline ,+6281210799334  (Klik nomor untuk chat via WA),Sudirman (Owner) : 021-92893859 / 081210799334   Abay : 021-32231045 , ,sudirmanalifgani@yahoo.com,Klik : http://www.easyenglishindonesia.com
Easy Pizza,Rp 27.500.000,Makanan & Minuman,-,cv easy food mandiri ,-,2011.0,-,6.0,darmo permai utara I/1 ,Easy Pizza ,+6287779999802  (Klik nomor untuk chat via WA),Hp : 087779999802 , ,easypizzasurabaya@gmail.com,-
Eden Farm,Rp (Please Call),Lainnya,-,PT. Eden Pangan Indonesia ,-,2017.0,-,1.0,"Lippo St. Moritz Tower Tower #09-02 Jl. Puri Raya Blok U1, Puri Indah, Jakarta Barat 11620 ",Eden Farm ,082113148385  (Klik nomor untuk chat via WA),Hp : 0821 1314 8385  Hp : 0811 1595 537 (Marketing) , ,info@edenfarm.id,Klik : http://edenfarm_id
Eito Japanese Curry,Rp 200.000.000,Makanan & Minuman,Rp 100.000.000,Eito Japanese Curry ,3%,2019.0,Rp 1.000.000,7.0,"Ruko Scientia Residences No.61 Gading Serpong, Tangerang ",Matthew Sinarto ,+628785616274  (Klik nomor untuk chat via WA),08170928085 , ,eitojapanesecurry@gmail.com,-
Ella Skincare,Rp 3.000.000,Kesehatan & Kecantikan,3.000.000,PT. Ella Karunia Estetika ,16%,2018.0,10.000.000,19.0,Jl. Bungur 5 No.14 B Punggawan Banjarsari Surakarta ,Yudith ,+6282223941127  (Klik nomor untuk chat via WA),0271731686 , ,alby@ellaskincare.co.id,Klik : https://www.ellaskincare.co.id/reseller
