Nama Franchise,Modal Minimal,Kategori Franchise,Franchise Fee,Nama Perusahaan,Biaya Royalti,Berdiri Sejak,Biaya Advertising,Jumlah Gerai,Alamat,Contact Person,Nomor WA,Telepon,Fax,Email,Website
Gorillaz,Rp 34.900.000,Otomotif,0,PT. Sinar Berkah Group ,0,2018.0,0,21.0,"Jl. Kalimas baru 29 A no 11-12, Surabaya  ",087852950666 ,+6287852950666  (Klik nomor untuk chat via WA),087852950666 , ,Info@gorillaz.id,Klik : http://www.gorillaz.id
Tahooe,Rp 15.000.000,Makanan & Minuman,FREE,Tahooe Indonesia ,5% dari Omset,2017.0,,6.0,Jl. Hayam Wuruk No.31 Kota Jambi ,082176908015 ,+6282176908015  (Klik nomor untuk chat via WA),082176908015 , ,info.tahooe@gmail.com,Klik : http://www.vazelteam.com
Kay Express Indonesia,Rp 350.000,Lainnya,10%,PT Kay Ocean Indonesia ,0,2014.0,0,5.0,"Komplek Niaga Graha Cibinong, Blok H No. 1-2, Jl. Raya Jakarta Bogor KM. 43 Cibinong 16917 ",Sugito Sigit ,+6285692220636  (Klik nomor untuk chat via WA),02183713286 , ,rifal@kayexpress.id,Klik : http://www.kayexpress.id
212 Mart,Rp 212.000.000,Retail,,Koperasi Syariah 212 ,,2017.0,,235.0,"Office Area Bellanova Country Mall No 5 - 6 Sentul City, Babakan Madang, Bogor, jawa Barat 16810, Indonesia ",212Mart ,+628116411212  (Klik nomor untuk chat via WA),08 212 212 2810 (Marketing)  0813 9814 3325 (Marketing)  0811 6411 212 (Kantor) , ,info@koperasisyariah212.co.id,Klik : http://koperasisyariah212.co.id
ROPI,Rp 100.000.000,Makanan & Minuman,Rp 20.000.000,PT Juara Roti Indonesia ,,2019.0,,53.0,"Jl. Terusan Inspeksi Kali Sunter No.39, RT.1/RW.1, Pulo Gadung, Kec. Pulo Gadung, Kota Jakarta Timur, Daerah Khusus Ibukota Jakarta 13260 ",Herisal Malik ,+628119890927  (Klik nomor untuk chat via WA),0811 4232 789 , ,rotiropi@gmail.com,Klik : https://rotiropi.com/
ORCHI Fried Chicken,Rp 13.750.000,Makanan & Minuman,GRATIS SEUMUR HIDUP,ORCHI INDONESIA GROUP ,GRATIS SEUMUR HIDUP,2007.0,GRATIIIISSS....,500.0,Jl.Raya Pulogebang No.43 Jakarta 13950 ,Admin Marketing Orchi ,+6281311606060  (Klik nomor untuk chat via WA),081311606060 (Ibu Santi) ,0214809962 ,cyberlink_2007@yahoo.co.id,Klik : http://www.orchi-indonesia.com
WISCO,Rp 5.000.000,Makanan & Minuman,0,KOES ISLAND GROUP ,no royalty fee,2011.0,0,387.0,"Jl.Bintan no 10 Grogolan, Ketelan, Banjarsari, Solo ",085702222138 ,+6285702222138  (Klik nomor untuk chat via WA),> Marketing Wisco Center Indonesia: 0857-0222-2138 ( WA / Telp ) FAST RESPON OFFICE HOURS SERVICE 24 JAM ============= other: 085728376002  pin BB WISCO CENTER: 5CE2EE6C  , ,wisco.chocolate@gmail.com,Klik : http://www.wiscochocolate.com
OMURA SHAKE ME UP,Rp 4.000.000,Makanan & Minuman,-,PT AGUNG FOOD INDUSTRINDO ,-,2019.0,-,20.0,"JL.GEDONG PANJANG NO.20 D , PEKOJAN , TAMBORA , JAKARTA BARAT ",OMURA SHAKE ME UP ,+6285281190170  (Klik nomor untuk chat via WA),Hp : 085281190170 Tlp: (021) 6901237 Tlp: 6901237(Marketing franchise) , ,omurashakemeup@gmail.com,Klik : http://www.omurashakemeup.com
GEROBAK COKELAT,Rp 137.000.000,Makanan & Minuman,-,CV Putra Indonesia (Property and Culinary) ,3 % per mulai bulan ke 8 (melihat Omset Record),2011.0,-,14.0,"Jalan SLamet Riyadi 510, Purwosari - Solo ",FATRA SATRIA DEVARA ,+6282230707900  (Klik nomor untuk chat via WA),Hp : 0822 3070 7900  Twitter : @GerobakCokelat  Instagram : @gerobak_cokelat_cafe ,- ,Gerobakcokelatindonesia@gmail.com,-
Kedai Kopi Kapal Api,Rp 10.000.000,Makanan & Minuman,-,PT.Santos Jaya Abadi ,-,2011.0,-,200.0,"Jl. Taman Jatibaru Barat No 1-3, Tanah Abang, Jakarta Pusat ",Kedai Kopi Kapal Api ,+6285782545357  (Klik nomor untuk chat via WA),Taufik Hidayat : 021-3914322 Ext 2303 atau 2302 Dwi Bakhtiar 085782545357   ,021 391 7904 ,dwi.bakhtiar@kapalapi.co.id,-
Izzah Fried Chicken,Rp 45.000.000,Makanan & Minuman,-,Izzah Fried Chicken ,-,2019.0,-,18.0,Komplek Ruko Bellanova Country Mall RK.3 No.1. Sentul City Bogor ,Azwar Haekal ,+628562061112  (Klik nomor untuk chat via WA),Hp : 08562061112  Jam Operational: 08:00 - 17:00 , ,azwar.haekal@koperasisyariah212.id,-
Chickenin (Little Shihlin),Rp 7.800.000,Makanan & Minuman,,Chickenin ,,2016.0,,104.0,"Jln. Bojong Asri 16 blok D24 no.4 - Taman Narogong Indah, Bekasi ",Handy Saputra ,+6282123526286  (Klik nomor untuk chat via WA),0821 2352 6286  , ,handysaputra28@gmail.com,-
Klik Chicken,Rp 8.000.000,Makanan & Minuman,-,Klik Chicken ,-,1997.0,-,8.0,"Jl. Bumi Pancoran Raya, Pancoran Mas - Depok ",Klik Chicken ,+6281314332024  (Klik nomor untuk chat via WA),Hp : 0897 1364 335  Hp : 0813 1433 2024 , ,mail@klikchicken.com,Klik : https://klikchicken.com
Bakso Benhil,Rp 4.000.000,Makanan & Minuman,- Tanpa Franchise Fee,Bakso Benhil ,- Tanpa Biaya Royalti,2012.0,- Tanpa Biaya Advertising,39.0,"Jl. Pondok raya B2, Tangerang, Banten  ",Kelik ,+6285868397955  (Klik nomor untuk chat via WA),0858 6839 7955  0853 2661 1689 ,- ,Kelik.baksobenhil@gmail.com,Klik : http://www.baksobenhil.com
BOBATIME INDONESIA,Rp 200.000.000,Makanan & Minuman,Rp 125 000 000,BATI Group ,Biaya Manajemen 5% dari Omset per bulan,,,24.0,"Jl. H. Agus Salim, No.40 Menteng, Jakarta Pusat INDONESIA ",BOBATIME INDONESIA ,+628111555080  (Klik nomor untuk chat via WA),0811 1555 080 , ,Kemitraan.bobatime@gmail.com,Klik : https://bobatime.id/franchise-minuman-boba/
Crispyku Fried Chicken,Rp 13.500.000,Makanan & Minuman,,CV Mitra Sukses Bogatama ,,2010.0,,500.0,"jl. Membramo 1 no.17, Villa gading permai, jakarta utara ",alex ,+628159979282  (Klik nomor untuk chat via WA),08159979282 (Marketing Manager) ,- ,crispyku@yahoo.com,Klik : http://Crispyku.com
8 Ice Blend & Squash,Rp 3.000.000,Makanan & Minuman,-,8 Ice Blend & Squash ,-,2015.0,-,100.0,Perumahan Mutiara Cempaka Blok E No. 14 RT/RW : 03/09 Desa Cempaka Kecamatan Plumbon Kabupaten Cirebon ,Monalisa Odittya Darmawan ,+6285722109953  (Klik nomor untuk chat via WA),Hp :0857 2210 9953 Hp :0878 2010 1987  , ,Pramanareni03@gmail.com,-
AA Raffi Fried Chicken,Rp 200.000.000,Makanan & Minuman,Rp 60 juta / 5 Thn,PT. CIPTA ANEKA SELERA ,,2018.0,,14.0,"Ruko Center Poin Krian Kav A-1 Jl. Raya Kemangsen, Balongbendo, Krian-Siduarjo ",AA Raffi Fried Chicken ,+6285293292929  (Klik nomor untuk chat via WA),Office : 031-8985522 HP : 0813 4200 0177 0852 9329 2929 0878 6118 1438 0812 8958 8080 , ,orakaeora@gmail.com,-
ABCheese,Rp 3.500.000,Makanan & Minuman,0,Prasetia Rasa (CoKo Group) ,0,2016.0,0,12.0,Jl.Babakan Tarogong no.123 Bandung (40231) ,ABCheese ,+6289502000325  (Klik nomor untuk chat via WA),0895 0200 0325 ,0226005008 ,abcheeseinfo@gmail.com,-
Afiah Pop Corn,Rp 5.300.000,Makanan & Minuman,-,'Afiah Jaya Mandiri ,-,2007.0,-,100.0,"Solo, Jawa Tengah ",Pop Corn ,+6281225970086  (Klik nomor untuk chat via WA),0812 2597 0086 0813 9299 9844 0821 3728 1516 , ,RumahWaralaba40@gmail.com,Klik : http://rumahwaralaba.com
Afiah Teh Segar,Rp 4.700.000,Makanan & Minuman,-,'Afiah Jaya Mandiri ,-,2007.0,-,100.0,"Solo, Jawa Tengah ",Teh Segar ,+6281225970086  (Klik nomor untuk chat via WA),0812 2597 0086 0813 9299 9844 0821 3728 1516 , ,RumahWaralaba40@gmail.com,Klik : http://rumahwaralaba.com
Afrakids,Rp 1.750.000,Retail,-,Afrakids ,-,2013.0,-,70.0,"Jalan Taman Wijaya Kusuma 1 No.D6, Cilandak Barat,  Jakarta Selatan, Indonesia.12430 ",Dian ,+6281298373013  (Klik nomor untuk chat via WA),021-7657161  WhatsApp: 0812-9837-3013 ,- ,"maula.alhaq@gmail.com, sales@afrakids.com",Klik : https://afrakids.com/
AGEWO Ayam Gepruk Wonogiri,Rp 18.000.000,Makanan & Minuman,-,AGEWO Ayam Gepruk Wonogiri ,-,2017.0,-,6.0,"Jalan Raya Pulo Gebang, Cakung, Jakarta Timur ",AGEWO Ayam Gepruk Wonogiri ,+6282246359585  (Klik nomor untuk chat via WA),0822 4635 9585 0852 1654 3669 , ,-,Klik : https://ayamgeprukwonogiri.blogspot.com/
AHE,Rp 1.800.000,Jasa Pendidikan & Pelatihan,-,Lembaga Pendidikan Anak Hebat ,-,2009.0,-,2000.0,"Jl. kraton 100, Kartosuro, Sukoharjo, Jawa Tengah ",AHE ,+6285728023123  (Klik nomor untuk chat via WA),Hp : 0857 2802 3123 , ,aryda117@gmail.com,Klik : http://www ahe.education
Ai Boba,Rp 5.500.000,Makanan & Minuman,-,Rachacha ,-,2019.0,-,50.0,"Gang Aster 3 RT.01/RW.12, Sanggrahan, Grogol, Sukoharjo ",Ai Boba ,+6282324207700  (Klik nomor untuk chat via WA),Hp : 082324207700 , ,aibobaid2019@gmail.com,Klik : http://aibobaindonesia.com
AI CHI,Rp 77.500.000,Makanan & Minuman,,AI CHI ,,2016.0,,5.0,"Ruko Bandengan Megah kav. 81 Blok A1, Penjaringan, Jakarta Utara, 14440 ",AI CHI ,+6282211124244  (Klik nomor untuk chat via WA),Phone: (021)66674957 , ,info@aichi.id,Klik : http://www.aichi.co.id
Ais Milo Kepal,Rp 9.900.000,Makanan & Minuman,gratis,CV. Startup International  ,gratis,2018.0,gratis,28.0,"Jl. Trembesi Blok D 4, Bandarbaru, Kemayoran  ",Ais Milo Kepal Customer Relation ,+6285735300400  (Klik nomor untuk chat via WA),Hp :085 735 300 400(Christyne) Hp :081 390 715 489 (Rista) , ,aismilokepal@gmail.com,Klik : http://www.aismilokepal.com
AI SUSHI,Rp 300.000.000,Makanan & Minuman,,AI SUSHI ,,2010.0,,3.0,Jl. Raya Kalimalang Kav.88 Jakarta ,AI SUSHI ,+6281288700575  (Klik nomor untuk chat via WA),Hp : 081321191420(irwansyah) Hp : 0811857677(daniel) Hp : 081288700575(fani) , ,infofranchise@aisushi-resto.co.id,-
Akademi Kopi,Rp 3.900.000,Makanan & Minuman,-,Akademi Kopi ,-,2018.0,-,500.0,"Jl. Adi Sucipto No.42, Puspan, Blulukan, Kec. Colomadu, Kabupaten Karanganyar, Jawa Tengah 57174 ",Akademi Kopi ,+6281328056644  (Klik nomor untuk chat via WA),Hp : 081328056644 , ,ciptabesar.bersama1@gmail.com,Klik : https://akademikopi.com/
Aku Cendol Kamu,Rp 3.900.000,Makanan & Minuman,, ,,2018.0,,100.0,"Jl. Adi Sucipto No.42, Puspan, Blulukan, Kec. Colomadu, Kabupaten Karanganyar, Jawa Tengah 57174 ",Aku Cendol Kamu ,+6285235204185  (Klik nomor untuk chat via WA),Whatsapp Marketing : 0852 3520 4185 0823 2440 3392  IG : @akucendolkamu , ,ciptabesar.bersama@gmail.com,Klik : http://akucendolkamu.com
Ali Ayam Goreng,Rp 13.800.000,Makanan & Minuman,,Ali Ayam Goreng ,,2017.0,,70.0,Komplek Sedayu Square Blok G no.29 cengkareng jakarta barat ,Ali Ayam Goreng ,+6281287279922  (Klik nomor untuk chat via WA),Hp : 081287279922 Tlp :(021)22524154/54313278 , ,sales@aliayamgoreng.com,-
Al-jabr Easy Math,Rp 10.000.000,Jasa Pendidikan & Pelatihan,8000000,Al-jabr Easy Math ,8%,2010.0,2%,15.0,"Perumahan de'Livina  B1/3, Jl Raya Bojong gede - Citayam, Bogor, Jawa Barat ",Kantor Pusat Al-Jabr Easy Math ,+6281385808905  (Klik nomor untuk chat via WA),Al-jabr Easy Math Franchise Centre (021) 879 897 58 & 0813 8361 6319  Al-jabr Easy English Franchise Centre (021) 879 897 58 & 0813 8361 6319  Al-jabr Easy Math Kid's Franchise Centre (021) 879 897 58 & 0813 8361 6319 ,02187903405 ,info.aljabr@gmail.com,Klik : http://aljabrgroup.wordpress.com
Aloha Rainbow Drink,Rp 6.500.000,Makanan & Minuman,-,Pelangi Seimbang Selaras ,-,2013.0,-,215.0,Raffless Hills Blok N5 No.15-16 Cibubur Jakarta Timur ,Marissa & Farry ,+628121004943  (Klik nomor untuk chat via WA),"0812.100.49.43, 0818.92.52.42, 0816.722.202, 021-37098736 ", ,sales@aloharainbowdrink.com,Klik : http://www.aloharainbowdrink.com
ALOLA NAILBAR,Rp 80.000.000,Kesehatan & Kecantikan,, ,5% dari omset Kotor,2016.0,,3.0,"KAWI RAYA NO 33, SEMARANG ",ALOLA NAILBAR ,+6281210000885  (Klik nomor untuk chat via WA),081210000885 , ,Alola.booking@gmail.com,-
AMAZY,Rp 80.000.000,Makanan & Minuman,-,PT MagFood Amazy Internasional ,500rb-2jt dari omzet/bulan,2001.0,,140.0,Jl.duren tiga raya no.46 jakarta selatan ,Suwanto ,+628558800780  (Klik nomor untuk chat via WA),0816 866 251  021-7919 3162 (kantor)* ,021-79195364 ,magfood@cbn.net.id,Klik : http://www.magfood-amazy.com
Ameno Ramen,Rp 30.000.000,Makanan & Minuman,10 %,Ameno.id ,10 % per tahun,2017.0,5 %,6.0,jln bonangan RT 3/4 fajar mutiara Baturan colomadu Karanganyar ,Ameno Ramen ,+6281776301467  (Klik nomor untuk chat via WA),081776301467 , ,ameno2706@gmail.com,Klik : http://www.ameno.id/
Angkringan Mbahe,Rp 7.500.000,Makanan & Minuman,0,Angkringan Mbahe ,0,2014.0,0,2.0,"Dalangan, Ngemplak, Kalikotes, Klaten, Jawa Tengah, Indonesia ",Eko Ristianto ,+6282113448921  (Klik nomor untuk chat via WA),0821 1344 8921 , ,angkringananakyatim@gmail.com,-
AonTea,Rp 5.500.000,Makanan & Minuman,-,AonTea ,-,2019.0,-,4.0,"Jl Gatot Subroto VII, Komplek Pondok Karya RT 23 No 37 Kebun Bunga Banjarmasin Timur Kalimantan Selatan ",AonTea ,+6283863003737  (Klik nomor untuk chat via WA),Hp : 0838 6300 3737 , ,aonteaid@gmail.com,-
Apotek K-24,Rp 1.000.000.000,Kesehatan & Kecantikan,Rp 120.000.000 + PPN,Apotek K-24 ,"1,8% + PPN dari omzet / bln",2002.0,,450.0,"K-24 Academy Lantai 3 Jl. Godean Km. 1, Kav. 24, Tambak, Yogyakarta ",Apotek K 24 ,+6281212012424  (Klik nomor untuk chat via WA),Hp : 081212012424 , ,apotekK24@mail.com,Klik : https://www.apotek-k24.com
Apple Tree Pre-school,Rp (Please Call),Jasa Pendidikan & Pelatihan,-,Apple Tree Pre-school ,-,2000.0,-,14.0,Jl. Muara Karang Blok i1 Selatan no. 26-28  Jakarta Utara 14450   ,Ms. Jessica ,,021 - 6695 952 (kantor)   ,021 - 66606083 ,jessica.jeval@appletreeps.com / wennychow@appletreeps.com,Klik : http://www.appletreeps.com
Arbai'in Es Madu,Rp 4.900.000,Makanan & Minuman,-,'Afiah Jaya Mandiri ,-,2007.0,-,100.0,"Solo, Jawa Tengah ",Rumah Waralaba ,+6281225970086  (Klik nomor untuk chat via WA),0812 2597 0086 0813 9299 9844 0821 3728 1516 , ,RumahWaralaba40@gmail.com,Klik : http://rumahwaralaba.com
Arofah Kebab,Rp 35.000.000,Makanan & Minuman,,CV Indo Berkah Mandiri ,,2012.0,,500.0,Jalan Raya Pondok Cipta Blok A3 No 33 Bintara Bekasi Barat ,Arofah Kebab ,+6282125951133  (Klik nomor untuk chat via WA),(021) 8896 8601  , ,arofahkebab.info@gmail.com,Klik : http://www.arofahkebab.com
Arofahmina Umroh Haji,Rp 500.000,Penginapan & Travel,0,PT. Arofah Mina ,0,2012.0,0,96.0,Jl. RA. Kartini No 84 Surabaya ,Husein Rahman ,+62282132376949  (Klik nomor untuk chat via WA),(031) 568 5782 0821 3237 6949 0811 3018 245 , ,uten26rachman@gmail.com,-
Arumanis Rainbow,Rp 8.200.000,Makanan & Minuman,-,Pelangi Seimbang Selaras ,-,2009.0,-,1000.0,Raffless Hills Blok N5 No.15-16 Cibubur Jakarta Timur ,Marissa & Farry ,+628121004943  (Klik nomor untuk chat via WA),0812.100.49.43  0818.92.52.42  0816.722.202  021 84311420 , ,sales@arumanisrainbow.com,Klik : http://www.arumanisrainbow.com
Asli Geprek,Rp 8.000.000,Makanan & Minuman,- Tidak Ada,Asli Geprek ,- Tidak Ada,2018.0,- Tidak Ada,90.0,"Perum AL Ciangsana, Jalan Alpajuli No. 58, Ciangsana, Gunung Putri, Bogor, Jawa Barat, 16968 ",Marketing Asli Geprek ,+6287821038066  (Klik nomor untuk chat via WA),Hp : 0878 2103 8066 , ,asligeprek@gmail.com,Klik : https://asliayamgeprek.com
AutoClean Waterless,Rp 81.000.000,Otomotif,Rp. 81.000.000,PT. AutoClean Waterless Indonesia ,-,2016.0,-,86.0,"Jalan Durian Raya, Baranangsiang, Bogor Timur ",Riva F Hassan ,+628119930216  (Klik nomor untuk chat via WA),0251 8365130 , ,kemitraan.autocleanwaterless@gmail.com,Klik : http://www.autocleanwaterless.com
Avobi,Rp 60.000.000,Makanan & Minuman,,Avobi ,,2020.0,,2.0,"Jl. Pangeran Tubagus Angke Grawisa Rt.03 / Rw.01, Wijaya Kusuma, Grogol Petamburan, Jakarta Barat ",Avobi ,+6282258542922  (Klik nomor untuk chat via WA),0822-5854-2922 , ,avobidrinks@gmail.com,Klik : http://avobi.id
Ayam Bakar Bhesus,Rp 10.000.000,Makanan & Minuman,,CV. Galerindo Nusantara ,,2016.0,,19.0,Jln. Ir Sutami No. 93 Jebres Surakarta ,082138554848 ,+6282138554848  (Klik nomor untuk chat via WA),082138554848 , ,ayambakarbhesus@gmail.com,Klik : http://www.ayambakarbhesus.com
AYAM BAKAR PAK D,Rp 15.000.000,Makanan & Minuman,-,PT MARSUDI UTOMO SEJAHTERA GROUP ,0%-3%,2008.0,-,52.0,"Jl nginden semolo no 2 Lt 3 , Surabaya, Jawa Timur ",AYAM BAKAR PAK D ,+6285272305662  (Klik nomor untuk chat via WA),Hp: 085272305662 Hp : 085851050500 Tlp: 0315990487 , ,Restoran.pakd@gmail.com,Klik : https://poradaan.com/franchise-ayam-bakar-pak-d/
Ayam Bebek Angsa Masak Di Kuali,Rp 49.000.000,Makanan & Minuman,-,Makko Group ,-,2018.0,-,25.0,"Jl. Raya Marina Indah, Komplek Ruko Cordoba Blok E No. 6, Pantai Indah Kapuk (PIK) Jakarta Utara ",Ayam Bebek Angsa Masak Di Kuali ,+6281382317668  (Klik nomor untuk chat via WA),Tlp : 021-29438375  Hp : 081382317668  Hp : 081519962299 , ,ayambebekangsa.official@gmail.com,-
AYAM BEBEK BAKAR MADINAH,Rp 10.000.000,Makanan & Minuman,-,Wahyuni Group ,-,2013.0,-,25.0,Jl. Surya Kencana Pamulang Barat Kota Tangerang Selatan Banten ,Wahyuni Group ,+6287884504990  (Klik nomor untuk chat via WA),Hp : 0878 8450 4990 , ,ayambebekpenyet.buwahyuni@gmail.com,Klik : https://wahyunigroup.com
Ayam Bebek Pak Boss,Rp 40.000.000,Makanan & Minuman,,Ayam Bebek Pak Boss ,,2017.0,,41.0,"Jl. Satria 1 no.34 Pademangan Barat, Jakarta Utara ",Ayam Bebek Pak Boss ,+628111588695  (Klik nomor untuk chat via WA),0811 1588 695 , ,ayambebekpakboss@gmail.com,Klik : http://www.instagram.com/ayambebekpakboss/?hl=id
AYAM BEBEK PENYET BU WAHYUNI,Rp 10.000.000,Makanan & Minuman,,Wahyuni Group ,,2013.0,,25.0,Jl. Surya Kencana Pamulang Barat Kota Tangerang Selatan Banten Indonesia ,Wahyuni Group ,+6287884504990  (Klik nomor untuk chat via WA),087884504990 , ,wahyunigroup@gmail.com,Klik : https://wahyunigroup.com
Ayam Dadar Bandung,Rp 10.000.000,Makanan & Minuman,,PT. Genetik Sukses mandiri ,,2013.0,,150.0,JL. ASIA - AFRIKA No.133-137 WISMA MONEX LT.9 ,Ayam Dadar Bandung ,+628986807575  (Klik nomor untuk chat via WA),No.Marketing Resmi Kami : - 0831 7464 3080 - 0857 8113 2540 - 0852 9575 0621 - 0898 7036 407 , ,ayamdadarbandung@yahoo.com,Klik : http://www.ayamdadarbandung.com
Ayam Ganeza,Rp 10.000.000,Makanan & Minuman,-,Ayam Ganeza ,-,,-,3.0,"Citra Garden 1 Blok B 7 No 17 Kalideres, Jakarta Barat ",Ayam Ganeza ,+6283876888558  (Klik nomor untuk chat via WA),Hp : 083876888558 , ,-,-
Ayam Geprek Abang Ireng,Rp 30.000.000,Makanan & Minuman,,Najah Group ,,2014.0,,28.0,"Perum griya mandiri gang mandiri 3 no. 6a RT/RW: 007/007, kronggahan, baturan, karanganyar ",Ayam Geprek Abang Ireng ,+6281325735869  (Klik nomor untuk chat via WA),0813 2573 5869 0857 8118 3033 , ,geprekabangireng@gmail.com,Klik : http://www.geprekabangireng.com
Ayam Geprek Bensae,Rp 2.500.000,Makanan & Minuman,-,Dapur Pintar ,-,2017.0,-,10.0,Komplek Binamarga Bojongsari No 40 RT 03/RW 04 Bojongsari Lama  ,Ayam Geprek Bensae ,+6281389000613  (Klik nomor untuk chat via WA),Hp : 0813 8900 0613 , ,connect@dapurpintar.id,Klik : http://www.dapurpintar.id
Ayam Geprek Gemess,Rp 8.000.000,Makanan & Minuman,-,Ayam Geprek Gemess ,-,2016.0,-,3.0,"jalan miwardi raya no 37a Grogol, Jakarta Barat ",021-2125 3447 ,+6287784511020  (Klik nomor untuk chat via WA),021-2125 3447 , ,samuelputragozali@gmail.com,-
Ayam Geprek Juara,Rp 200.000.000,Makanan & Minuman,,Ayam Geprek Juara ,,2013.0,,67.0,"Rukan Sentra Pemuda, Jl. Pemuda No. 61 Kav. 28 Rawamangun, RT.9/RW.3, Rawamangun, Kec. Pulo Gadung ",Ayam Geprek Juara ,+6281113302430  (Klik nomor untuk chat via WA),HP 0811 1330 2430 , ,-,Klik : http://ayamgeprekjuara.com
Ayam Geprek Kampus,Rp 50.000.000,Makanan & Minuman,10000000,Ayam Geprek Kampus ,2%,2018.0,1%,11.0,"Jl. Dipatiukur No.51, Lebakgede, Coblong, Kota Bandung Jawa Barat 40132 ",0822 9999 1916 ,+6282299991916  (Klik nomor untuk chat via WA),0822 9999 1916 , ,ayamgeprekkampus@gmail.com,Klik : http://ayamgeprekkampus.com/
Ayam GEPREK KISANAK,Rp 19.000.000,Makanan & Minuman,0,CV Kisanak Global Food ,0,2019.0,0,6.0,Citra Garden 3 Pegadungan Kalideres Jakarta barat 11830 ,Damayanti ,+6285777707407  (Klik nomor untuk chat via WA),0823 1150 0055  0857 7770 7407 , ,Keripikkisanak@gmail.com,-
Ayam Geprek Mang Soetta,Rp 300.000.000,Makanan & Minuman,,Ayam Geprek Mang Soetta ,,2017.0,,8.0,Jl ayami 243 surabaya ,Ayam Geprek Mang Soetta ,+6289521533233  (Klik nomor untuk chat via WA),Hp : 089521533233 Hp : 085745520588 Hp : 085790291728 , ,-,-
Ayam Geprek Master,Rp 95.000.000,Makanan & Minuman,-,Ayam Geprek Master ,-,2017.0,-,50.0,"Jln. Kebon Jeruk XIII No 7 Taman Sari, Jakarta ",Ayam Geprek Master ,+6281283350594  (Klik nomor untuk chat via WA),0812 8335 0594 , ,geprekmaster@gmail.com,Klik : https://ayamgeprekmaster.com
AYAM GEPREK MR.D,Rp 5.500.000,Makanan & Minuman,0,AYAM BAKAR PAK D GROUP ,0,2020.0,0,20.0,"Jl nginden semolo no 2, surabaya ",AYAM GEPREK MR D ,+6285272305662  (Klik nomor untuk chat via WA),(031) 599 0487  Hp : 0852 7230 5662 : 0812 3430 9260 , ,katanyadayat@gmail.com,Klik : https://ayamgeprekmrd.press/
Ayam Geprek Ndablek,Rp 58.000.000,Makanan & Minuman,,Ayam Geprek Ndablek ,FREE,2017.0,,5.0,Jl. Galunggung no 78C Malang ,Julia ,+6281901171919  (Klik nomor untuk chat via WA),081901171919 , ,ayamgeprekndablek@gmail.com,Klik : http://www.ayamgeprekndablek.com
Ayam Gepuk Pak Gembus,Rp (Please Call),Makanan & Minuman,, ,,2013.0,,312.0,"MAQNA RESIDENCE Ruko 8 dan 9 Jl. Meruya Ilir Raya No. 88 Rt.1/ Rw.5, Meruya Utara, Jakarta Barat, DKI Jakarta 11610 ",Ayam Gepuk Pak Gembus ,+628121800050  (Klik nomor untuk chat via WA),(021) 131 113 814  (021) 131 113 814  +62 812 1800 050 , ,support@ayamgepukpakgembus.co.id,Klik : https://www.ayamgepukpakgembus.co.id/
Ayam Geybok Bang Jarwo,Rp (Please Call),Makanan & Minuman,-,Ayam Geybok Bang Jarwo ,-,2018.0,-,5.0,Jl Pondok Kelapa Raya Blok L10 no.1D - Jakarta Timur ,Ayam Geybok Bang Jarwo ,+628159303248  (Klik nomor untuk chat via WA),Hp : 0815 930 3248 Tlp: (021) 831 4228 , ,geybokbangjarwo@gmail.com,-
Ayam Goreng Malioboro,Rp 550.000.000,Makanan & Minuman,5% Dari Hasil,Ayam Goreng Malioboro ,,1986.0,,4.0,"Jl. Ir. Soekarno AB 01, Solo Baru - Sukoharjo ",Ayam Goreng Malioboro ,+6285707358888  (Klik nomor untuk chat via WA),0856 4320 8111 (Bp Leo Owner)  (0271) 622 404 , ,kremesayammalioboro@gmail.com,Klik : http://www.instagram.com/kremesayammalioboro/?hl=id
AYAM GUNTING CUWAN,Rp 4.999.000,Makanan & Minuman,,Mitra Boga Jaya ,,2020.0,,5.0,"Jl. Adi Sucipto, Manahan, Kec. Banjarsari, Kota Surakarta, Jawa Tengah 57139 ",AYAM GUNTING CUWAN ,+6287812609689  (Klik nomor untuk chat via WA),0878 1260 9689 , ,mommilkexpress@gmail.com,Klik : http://www.ayamguntingcuwan.com
Ayam Hootz,Rp 75.000.000,Makanan & Minuman,-,PT Hasana Sukses Nusantara ,-,2019.0,-,20.0,Jl. Harapan Indah Raya No.20A RT 008/017 ,Ayam Hootz ,+628111919182  (Klik nomor untuk chat via WA),Hp : 0813 8338 2281 Hp : 0811 1919 182 , ,-,-
Ayam Jerit By Titi Kamal,Rp 600.000.000,Makanan & Minuman,,Ayam Jerit By Titi Kamal ,,2016.0,,10.0,"Teras Benhil Lantai 1, Jl. Bendungan Hilir No.34, RT.8/RW.1, Bend. Hilir, Tanah Abang, Jakarta Pusat ",Ayam Jerit By Titi Kamal ,+6282113131343  (Klik nomor untuk chat via WA),Hp : 0821 1313 1343 Tlp: (021) 781 3006 , ,-,Klik : https://ayamjerit.co.id/
Ayam Koplo,Rp (Please Call),Makanan & Minuman,,PT. Modular Kuliner ,,2019.0,,41.0,"Ruko Graha Arteri, Unit 36-37. Jalan Panjang no 36, Kedoya Selatan Kebon Jeruk, Jakarta Barat ",Ayam Koplo ,+6281808455668  (Klik nomor untuk chat via WA),Marketing Franchise : - Martha : +62 812 6640 6532 - Marissa : +62 818 0845 5668 - Riza : +62 812 8519 1127 , ,partnership@ishangry.com,-
Ayam Legit,Rp 40.000.000,Makanan & Minuman,-,Ayam Legit ,-,2019.0,-,10.0,"Gajahmada Tower Lt. 17, Jakarta Pusat ",Ayam Legit ,+6282250001421  (Klik nomor untuk chat via WA),0822 5000 1421 , ,kulineranakindonesia@gmail.com,-
Ayam Monyet,Rp 250.000.000,Makanan & Minuman,-,Ayam Monyet ,-,2012.0,-,9.0,"Jl. Pangkalan Jati No 1 Pondok Labu, Jakarta Selatan   ",Ayam Monyet ,+6285692916468  (Klik nomor untuk chat via WA),Hp : 0856 9291 6468 0812 8358 9767 , ,-,-
Ayam Ngamok,Rp 50.000.000,Makanan & Minuman,0,Simerah Berkah ,0,2017.0,0,6.0,jalan mertojoyo selatan no 8 Malang ,081233660022 ,+6281233660022  (Klik nomor untuk chat via WA),081233660022 , ,ekasimerah@gmail.com,-
Ayam Ngemper,Rp 45.000.000,Makanan & Minuman,-,Idea Corp ,-,2019.0,-,5.0,"Jl. Kebon Raya no.9 Duri Kepa, Kebun Jeruk, Jakarta Barat ",Ayam Ngemper ,+6281919788877  (Klik nomor untuk chat via WA),0822 6000 6708 0819 1978 8877 , ,sekretarisidea@gmail.com,-
Ayam Rempah Sarawa,Rp 20.000.000,Makanan & Minuman,-,Ayam Rempah Sarawa ,-,2020.0,-,1.0,"Jl. H. Damanhuri, Barabai, Kab. Hulu Sungai Tengah Provinsi Kalimantan Selatan ",Agus Budiman ,+6282255334039  (Klik nomor untuk chat via WA),082255334039 , ,ayamrempahsarawa@gmail.com,Klik : https://www.instagram.com/ayamrempahsarawa
Ayam Selebriti,Rp 15.000.000,Makanan & Minuman,"Rp 15.000.000,-",Ayam Selebriti Group ,"Rp 1.000.000,-",2017.0,"Rp 750.000,- (tidak wajib)",4.0,"Ruko Intercon Megah blok W 3 No .17 Srengseng, Kembangan, Jakarta Barat ",Ayam Selebriti ,+628111118211  (Klik nomor untuk chat via WA),021 - 5860 248  0811 111 821 , ,ayamselebriti@gmail.com,Klik : http://www.ayamselebriti.com
Ayam Setan,Rp 18.000.000,Makanan & Minuman,FREE,Ayam Setan ,FREE,2017.0,5%,5.0,Apartemen Mediterania 1 - Jakarta Barat ,Jonny Andrean ,+628179987988  (Klik nomor untuk chat via WA),08179987988 , ,ayamsetan.id@gmail.com,Klik : http://instagram.com/ayamsetan.id
Ayam Strong,Rp 36.400.000,Makanan & Minuman,-,PT Berkah Pangan Sejahtera ,-,2016.0,-,40.0,Jln Parapat C7 No 6 Jaticempaka Pondok Gede 17411 ,Ayam Strong ,+6282123208202  (Klik nomor untuk chat via WA),0821 2320 8202 0822 1000 0062 , ,ayamstrongid@gmail.com,Klik : http://www.ayamstrong.com
Ayo Toast,Rp 2.999.000,Makanan & Minuman,-,CV ESCORP MUDA BERKREASI ,-,2020.0,-,85.0,"Perumahan Kampung Semawis Blok P No.26. Jln. Gambang semarang II. Kedungmundu, Tembalang, semarang 50273  ",Ayo Toast ,+6285799773777  (Klik nomor untuk chat via WA),Hp : 0821 3358 8885  Hp : 0857 9977 3777(Marketing) , ,escorpindonesia@gmail,-
Bakmi Naga Resto,Rp 95.000.000,Makanan & Minuman,-,PT. NAGA JAYA SEJAHTERA INDONESIA ,-,1979.0,-,30.0,"Komplek Kelapa Gading Trade Center Blok A3 & A5 Jl. Raya Boulevard Barat, Kelapa Gading - Jakarta Utara 14240 ",Bakmi Naga Resto ,+6282216244238  (Klik nomor untuk chat via WA),(021) 4585 8927  (021) 4585 8928  (021) 4585 8929 HP : 0816 1880 092  0851 0578 9688  , ,susantywidjaya@nagaresto.com,Klik : http://www.bakminagaresto.com
bakoel tea,Rp 7.500.000,Makanan & Minuman,-,PT robert group abadi ,-,2021.0,-,3.0,"Jl Palakali No 47 Kukusan , Beji , Depok ",bakoel tea ,+628972707090  (Klik nomor untuk chat via WA),Hp : 08972707090 , ,bakoelteaindonesia@gmail.com,-
